index,country_fullname,podcast_id,im_name_label,summary_label,summary_label_en_cleaned,link_attributes_href,feedurl,artwork,summary_label_en_cleaned_brief,hover_text,x,y
0,China,799279397,环球故事会,"形形色色的人生, 五味杂成的故事, 百转千回更令人回味. 每周一至周五上午10点, 听段淳给您讲故事. 关注微信订阅号 CRI Podcast 及时了解节目更新动态.","4. The life of all kinds of life, the story of mixed tastes, and the thousands of turns are more evocative. Every Monday to Friday at 10 am, I will tell you a story. Follow WeChat subscription number CRI Podcast to learn about program updates.",https://podcasts.apple.com/cn/podcast/%E7%8E%AF%E7%90%83%E6%95%85%E4%BA%8B%E4%BC%9A/id799279397?uo=2,http://feed.cri.cn/rss/6720a782-79df-4028-a978-0e6d65623b5c,https://is3-ssl.mzstatic.com/image/thumb/Music113/v4/7b/fb/8b/7bfb8b93-9542-27f3-0f06-0b7d24b76d03/source/600x600bb.jpg,"4. The life of all kinds of life, the story of<br>mixed tastes, and the thousands of turns are more<br>evocative. Every Monday to Friday at 10 am, I will<br>tell you a story. ...","环球故事会<br>4. The life of all kinds of life, the story of<br>mixed tastes, and the thousands of turns are more<br>evocative. Every Monday to Friday at 10 am, I will<br>tell you a story. ...",-4.1256924,9.416369
1,China,1256399960,故事 FM,"欢迎收听故事 FM . 在这里, 我们用你的声音, 讲述你的故事. 每周一, 三, 五, 同步更新.","Welcome to the story FM. Here, we use your voice to tell your story. Every Monday, Wednesday, Friday, sync updates.",https://podcasts.apple.com/cn/podcast/%E6%95%85%E4%BA%8B-fm/id1256399960?uo=2,http://storyfm.cn/feed/episodes,https://is5-ssl.mzstatic.com/image/thumb/Music123/v4/cd/c6/9d/cdc69d87-7cfa-cafb-ab9b-77c4c79d9496/source/600x600bb.jpg,"Welcome to the story FM. Here, we use your voice<br>to tell your story. Every Monday, Wednesday,<br>Friday, sync updates. ...","故事 FM<br>Welcome to the story FM. Here, we use your voice<br>to tell your story. Every Monday, Wednesday,<br>Friday, sync updates. ...",-1.7293928,11.280135
2,China,1030448996,博物志,bowuzhi.fm 一档关于博物馆的播客.,Bowuzhi.fm A podcast about the museum.,https://podcasts.apple.com/cn/podcast/%E5%8D%9A%E7%89%A9%E5%BF%97/id1030448996?uo=2,https://feeds.fireside.fm/museelogue/rss,https://is5-ssl.mzstatic.com/image/thumb/Music113/v4/da/25/c1/da25c1fa-c092-799d-4fa5-b21c77637093/source/600x600bb.jpg,Bowuzhi.fm A podcast about the museum. ...,博物志<br>Bowuzhi.fm A podcast about the museum. ...,-14.72701,7.485819
3,China,793040690,Round Table China,"Round Table is the premiere English talk show that debates issues affecting China. The show shines with its three hosts who come from diverse backgrounds and offer bold as well as researched discussion on some of the hottest topics headlining in the Middle Kingdom. Everything from economic regulation to social issues, cultural differences to gender differences, the RT team has you covered with comprehensive information and addicting charisma.","Round Table is the premiere English talk show that debates issues affecting China. The show shines with its three hosts who come from diverse backgrounds and offer bold as well as researched discussion on some of the hottest topics headlining in the Middle Kingdom. Everything from economic regulation to social issues, cultural differences to gender differences, the RT team has you covered with comprehensive information and addicting charisma.",https://podcasts.apple.com/cn/podcast/round-table-china/id793040690?uo=2,https://aezfm.meldingcloud.com/rss/program/11,https://is5-ssl.mzstatic.com/image/thumb/Music113/v4/a2/c0/36/a2c036de-eaef-5712-f994-37b6a832f799/source/600x600bb.jpg,Round Table is the premiere English talk show that<br>debates issues affecting China. The show shines<br>with its three hosts who come from diverse<br>backgrounds and offer bold as well as researched<br>discussion on some of the hottest topics<br>headlining in the Middle Kingdom. ...,Round Table China<br>Round Table is the premiere English talk show that<br>debates issues affecting China. The show shines<br>with its three hosts who come from diverse<br>backgrounds and offer bold as well as researched<br>discussion on some of the hottest topics<br>headlining in the Middle Kingdom. ...,3.9802098,-10.737782
4,China,786823901,轻阅读,"所有的好书都在这里等你, 轻阅读, 你的私人电台书房. ""轻阅读""由中国国际广播电台华语环球广播中心出品, 是一档文化分享类节目. 我们邀请各界嘉宾分享阅读, 交流观点, 全方位, 多角度地展示当代中国文化.","All good books are waiting for you here, light reading, your private radio study. ""Light reading"" is produced by China Radio International Chinese Broadcasting Center and is a cultural sharing program. We invite guests from all walks of life to share reading, exchange ideas, and provide a comprehensive and multi-faceted display of contemporary Chinese culture.",https://podcasts.apple.com/cn/podcast/%E8%BD%BB%E9%98%85%E8%AF%BB/id786823901?uo=2,http://feed.cri.cn/rss/31295a33-de9b-409a-82ce-7905207f6c00,https://is2-ssl.mzstatic.com/image/thumb/Music128/v4/e8/e1/a1/e8e1a131-ea12-71d8-d1b9-6694b2bd2005/source/600x600bb.jpg,"All good books are waiting for you here, light<br>reading, your private radio study. ""Light reading""<br>is produced by China Radio International Chinese<br>Broadcasting Center and is a cultural sharing<br>program. ...","轻阅读<br>All good books are waiting for you here, light<br>reading, your private radio study. ""Light reading""<br>is produced by China Radio International Chinese<br>Broadcasting Center and is a cultural sharing<br>program. ...",-7.151403,11.211486
5,China,1243945491,文化土豆 Culture Potato,"文化土豆 Culture Potato 是 @益康糯米 主持的文艺潮流圆桌节目, 每周和两位朋友讨论最近看过的影视佳作, 每月一次的误读会讨论文学经典, 不定期还有会讨论思想和艺术类话题. 文化土豆是苹果 iTunes 评选的 2017 最佳新播客 和 2018 最佳播客奖项得主. 官网:","Culture Potato is a literary trend round table program hosted by @益康糯米. It discusses the recent film and television masterpieces with two friends. The monthly misreading will discuss literary classics, and occasionally discuss ideas and art. Class topic. Culture Potato is the 2017 Best New Podcast and 2018 Best Podcast Winner of Apple's iTunes Awards. Official website:",https://podcasts.apple.com/cn/podcast/%E6%96%87%E5%8C%96%E5%9C%9F%E8%B1%86-culture-potato/id1243945491?uo=2,http://www.spreaker.com/show/2571819/episodes/feed,https://is2-ssl.mzstatic.com/image/thumb/Music113/v4/02/3e/f3/023ef3f9-e376-d9b1-388f-31de74594ff7/source/600x600bb.jpg,"Culture Potato is a literary trend round table<br>program hosted by @益康糯米. It discusses the recent<br>film and television masterpieces with two friends.<br>The monthly misreading will discuss literary<br>classics, and occasionally discuss ideas and art.<br>Class topic. ...","文化土豆 Culture Potato<br>Culture Potato is a literary trend round table<br>program hosted by @益康糯米. It discusses the recent<br>film and television masterpieces with two friends.<br>The monthly misreading will discuss literary<br>classics, and occasionally discuss ideas and art.<br>Class topic. ...",-14.722195,6.4552574
6,China,278981407,Stuff You Should Know,"If you've ever wanted to know about champagne, satanism, the Stonewall Uprising, chaos theory, LSD, El Nino, true crime and Rosa Parks then look no further. Josh and Chuck have you covered.","If you've ever wanted to know about champagne, satanism, the Stonewall Uprising, chaos theory, LSD, El Nino, true crime and Rosa Parks then look no further. Josh and Chuck have you covered.",https://podcasts.apple.com/cn/podcast/stuff-you-should-know/id278981407?uo=2,https://feeds.megaphone.fm/stuffyoushouldknow,https://is2-ssl.mzstatic.com/image/thumb/Music113/v4/88/c5/f9/88c5f9f6-1342-99dd-2521-bc881d92790b/source/600x600bb.jpg,"If you've ever wanted to know about champagne,<br>satanism, the Stonewall Uprising, chaos theory,<br>LSD, El Nino, true crime and Rosa Parks then look<br>no further. ...","Stuff You Should Know<br>If you've ever wanted to know about champagne,<br>satanism, the Stonewall Uprising, chaos theory,<br>LSD, El Nino, true crime and Rosa Parks then look<br>no further. ...",3.32855,-6.8897147
7,China,1358602158,听见,"""听见""是中国国际广播电台一档访谈类节目, 意为""听别人的故事, 形成对这个时代的见解"". 变迁中的中国, 是一个非常值得关注和记述的样本. 个体是时代的主角, 他们的过去, 现在, 未来构成了当代中国的面貌.","""Hearing"" is an interview program of China Radio International, which means ""listening to other people's stories and forming insights into this era."" China in transition is a sample that deserves much attention and description. Individuals are the protagonists of the times, their past, present, and future constitute the face of contemporary China.",https://podcasts.apple.com/cn/podcast/%E5%90%AC%E8%A7%81/id1358602158?uo=2,http://feed.cri.cn/rss/9b6fda64-be7b-c5e8-1692-d71d83b5ea57,https://is4-ssl.mzstatic.com/image/thumb/Music113/v4/74/fd/ad/74fdad61-5820-62fc-c683-c85b4cbdf38b/source/600x600bb.jpg,"""Hearing"" is an interview program of China Radio<br>International, which means ""listening to other<br>people's stories and forming insights into this<br>era."" China in transition is a sample that<br>deserves much attention and description. ...","听见<br>""Hearing"" is an interview program of China Radio<br>International, which means ""listening to other<br>people's stories and forming insights into this<br>era."" China in transition is a sample that<br>deserves much attention and description. ...",-3.0042236,9.977874
8,China,1119089237,翻转电台Flip Radio,人人都是主播,Everyone is the anchor,https://podcasts.apple.com/cn/podcast/%E7%BF%BB%E8%BD%AC%E7%94%B5%E5%8F%B0flip-radio/id1119089237?uo=2,http://rss.lizhi.fm/rss/1057263.xml,https://is5-ssl.mzstatic.com/image/thumb/Music123/v4/8c/af/1b/8caf1b77-6992-a866-f06f-320460a00fcb/source/600x600bb.jpg,Everyone is the anchor ...,翻转电台Flip Radio<br>Everyone is the anchor ...,11.609706,-14.608274
9,China,354668519,Freakonomics Radio,"Discover the hidden side of everything with Stephen J. Dubner, co-author of the Freakonomics books. Each week, Freakonomics Radio tells you things you always thought you knew (but didn't) and things you never thought you wanted to know (but do) - from the economics of sleep to how to become great at just about anything. Dubner speaks with Nobel laureates and provocateurs, intellectuals and entrepreneurs, and various other underachievers. Special features include series like ""The Secret Life of a C.E.O."" as well as a live game show, ""Tell Me Something I Don't Know.""","Discover the hidden side of everything with Stephen J. Dubner, co-author of the Freakonomics books. Each week, Freakonomics Radio tells you things you always thought you knew (but didn't) and things you never thought you wanted to know (but do) - from the economics of sleep to how to become great at just about anything. Dubner speaks with Nobel laureates and provocateurs, intellectuals and entrepreneurs, and various other underachievers. Special features include series like ""The Secret Life of a C.E.O."" as well as a live game show, ""Tell Me Something I Don't Know.""",https://podcasts.apple.com/cn/podcast/freakonomics-radio/id354668519?uo=2,https://rss.art19.com/freakonomics-radio,https://is1-ssl.mzstatic.com/image/thumb/Music113/v4/8e/5f/f3/8e5ff38a-4281-c4d1-134f-b5ddf19cbcea/source/600x600bb.jpg,"Discover the hidden side of everything with<br>Stephen J. Dubner, co-author of the Freakonomics<br>books. Each week, Freakonomics Radio tells you<br>things you always thought you knew (but didn't)<br>and things you never thought you wanted to know<br>(but do) - from the economics of sleep to how to<br>become great at just about anything. ...","Freakonomics Radio<br>Discover the hidden side of everything with<br>Stephen J. Dubner, co-author of the Freakonomics<br>books. Each week, Freakonomics Radio tells you<br>things you always thought you knew (but didn't)<br>and things you never thought you wanted to know<br>(but do) - from the economics of sleep to how to<br>become great at just about anything. ...",5.143956,-8.509718
10,China,594791788,小凤直播室,"牛人云集的电台访谈, 真正的大师课堂, 汇集当代中国最有意思的人和最有意思的谈话, 小凤以一己之力, 十四年来, 寻访国内先锋文化及学术思想领域各派高手, 每一位嘉宾还将随身带一本书, 一部电影和一张唱片……绝对知性, 绝对迷人, 这一剂思想的毒药, 一旦喝下, 入骨入髓. 出品方: 山东广播电视台经济广播 官方主页: 齐鲁网""小凤直播室"" 新浪微博: @小凤丢手绢 豆瓣网""小凤直播室""小组","Radio interviews with cattle people, the real master class, bringing together the most interesting people and the most interesting conversations in contemporary China. Xiaofeng has been trying his best to visit the masters of domestic pioneering culture and academic thought in each of the fourteen years. The guest will also bring a book, a movie and a record with him... Absolutely intellectual, absolutely fascinating, this poison of thought, once it is drunk, enters the bones. Producer: Shandong Radio and Television Economic Broadcasting Official homepage: Qilu Wang ""Xiaofeng Live Room"" Sina Weibo: @小凤丢手绢 Douban net ""Xiaofeng live room"" group",https://podcasts.apple.com/cn/podcast/%E5%B0%8F%E5%87%A4%E7%9B%B4%E6%92%AD%E5%AE%A4/id594791788?uo=2,http://rss.kaolafm.com/MZ_RSS/rss/1100000046071/album.xml,https://is2-ssl.mzstatic.com/image/thumb/Music113/v4/df/ea/5b/dfea5bf1-0333-b83a-6edf-3b0bf473e0cd/source/600x600bb.jpg,"Radio interviews with cattle people, the real<br>master class, bringing together the most<br>interesting people and the most interesting<br>conversations in contemporary China. Xiaofeng has<br>been trying his best to visit the masters of<br>domestic pioneering culture and academic thought<br>in each of the fourteen years. The guest will also<br>bring a book, a movie and a record with him...<br>Absolutely intellectual, absolutely fascinating,<br>this poison of thought, once it is drunk, enters<br>the bones. ...","小凤直播室<br>Radio interviews with cattle people, the real<br>master class, bringing together the most<br>interesting people and the most interesting<br>conversations in contemporary China. Xiaofeng has<br>been trying his best to visit the masters of<br>domestic pioneering culture and academic thought<br>in each of the fourteen years. The guest will also<br>bring a book, a movie and a record with him...<br>Absolutely intellectual, absolutely fascinating,<br>this poison of thought, once it is drunk, enters<br>the bones. ...",-14.806803,6.290426
11,China,817906640,Round Table 圆桌议事,人人都是主播,Everyone is the anchor,https://podcasts.apple.com/cn/podcast/round-table-%E5%9C%86%E6%A1%8C%E8%AE%AE%E4%BA%8B/id817906640?uo=2,http://rss.lizhi.fm/rss/49830.xml,https://is3-ssl.mzstatic.com/image/thumb/Music123/v4/7b/d8/dd/7bd8ddd7-7b8e-07fc-52a8-35fa229c713c/source/600x600bb.jpg,Everyone is the anchor ...,Round Table 圆桌议事<br>Everyone is the anchor ...,-1.3351029,8.162416
12,China,1446709653,Deep Dive: Talks with Chinese Internationals,"They're Chinese, but they're also internationals. They have learned from the world and in return, they have made great contributions of their own. If you'd like to meet some of them, check in with our podcast series, ""Deep Dive – Talks with Chinese Internationals.""","They're Chinese, but they're also internationals. They have learned from the world and in return, they have made great contributions of their own. If you'd like to meet some of them, check in with our podcast series, ""Deep Dive – Talks with Chinese Internationals.""",https://podcasts.apple.com/cn/podcast/deep-dive-talks-with-chinese-internationals/id1446709653?uo=2,https://aezfm.meldingcloud.com/rss/programother/110,https://is4-ssl.mzstatic.com/image/thumb/Music113/v4/35/9a/2c/359a2cb5-ef1c-5813-8fbf-fd76816c2e85/source/600x600bb.jpg,"They're Chinese, but they're also internationals.<br>They have learned from the world and in return,<br>they have made great contributions of their own.<br>If you'd like to meet some of them, check in with<br>our podcast series, ""Deep Dive – Talks with<br>Chinese Internationals."" ...","Deep Dive: Talks with Chinese Internationals<br>They're Chinese, but they're also internationals.<br>They have learned from the world and in return,<br>they have made great contributions of their own.<br>If you'd like to meet some of them, check in with<br>our podcast series, ""Deep Dive – Talks with<br>Chinese Internationals."" ...",-0.6428703,6.9065976
13,China,1129660186,迟早更新,"""迟早更新""是一档探讨科技, 商业, 设计和生活之间混沌关系的播客节目, 也是风险基金 ONES Ventures 关于热情, 趣味和好奇心的音频记录. 我们希望通过这档播客, 能让熟悉的事物变得新鲜, 让新鲜的事物变得熟悉.","""Soon and Late Update"" is a podcast that explores the chaotic relationship between technology, business, design and life. It is also an audio record of the passion fund, ONES Ventures, about passion, fun and curiosity. We hope that through this podcast, we can make familiar things fresh and familiar with new things.",https://podcasts.apple.com/cn/podcast/%E8%BF%9F%E6%97%A9%E6%9B%B4%E6%96%B0/id1129660186?uo=2,http://rss.lizhi.fm/rss/1728291.xml,https://is4-ssl.mzstatic.com/image/thumb/Music124/v4/92/33/ff/9233fffc-5a0b-bfcc-62e0-951dd207554a/source/600x600bb.jpg,"""Soon and Late Update"" is a podcast that explores<br>the chaotic relationship between technology,<br>business, design and life. It is also an audio<br>record of the passion fund, ONES Ventures, about<br>passion, fun and curiosity. ...","迟早更新<br>""Soon and Late Update"" is a podcast that explores<br>the chaotic relationship between technology,<br>business, design and life. It is also an audio<br>record of the passion fund, ONES Ventures, about<br>passion, fun and curiosity. ...",-18.710363,-5.258404
14,China,691053254,好妹妹,"""你好妹妹Radio""是由好妹妹自主创立的专属电台, 主持人是秦昊, 张小厚.","""Hello sister Radio"" is a dedicated radio station created by a good sister. The host is Qin Wei, Zhang Xiaohou.",https://podcasts.apple.com/cn/podcast/%E5%A5%BD%E5%A6%B9%E5%A6%B9/id691053254?uo=2,http://rss.lizhi.fm/rss/70572.xml,https://is1-ssl.mzstatic.com/image/thumb/Music113/v4/fd/d7/99/fdd799d8-42e8-735d-cbe9-87a3c2bf42ed/source/600x600bb.jpg,"""Hello sister Radio"" is a dedicated radio station<br>created by a good sister. The host is Qin Wei,<br>Zhang Xiaohou. ...","好妹妹<br>""Hello sister Radio"" is a dedicated radio station<br>created by a good sister. The host is Qin Wei,<br>Zhang Xiaohou. ...",-4.4078655,12.596815
15,China,799275564,档案揭秘,"人类的历史, 决不会因为年代的久远而失去生命, 它的鲜活, 只要拂去档案上厚厚的尘土依旧会让世界震惊, 秘密就在这一刻揭示. 关注微信订阅号 CRI Podcast 及时了解节目更新动态.","The history of mankind will never lose its life because of its age. Its fresh life, as long as the thick dust on the archives will still shock the world, the secret is revealed at this moment. Follow WeChat subscription number CRI Podcast to keep up to date with program updates.",https://podcasts.apple.com/cn/podcast/%E6%A1%A3%E6%A1%88%E6%8F%AD%E7%A7%98/id799275564?uo=2,http://feed.cri.cn/rss/2c1d0368-361b-4e88-bceb-e14e9c93cdcd,https://is5-ssl.mzstatic.com/image/thumb/Music123/v4/82/88/7c/82887c24-c770-fd03-ea98-f817eedff3a1/source/600x600bb.jpg,"The history of mankind will never lose its life<br>because of its age. Its fresh life, as long as the<br>thick dust on the archives will still shock the<br>world, the secret is revealed at this moment. ...","档案揭秘<br>The history of mankind will never lose its life<br>because of its age. Its fresh life, as long as the<br>thick dust on the archives will still shock the<br>world, the secret is revealed at this moment. ...",-6.73079,8.949366
16,China,1441243418,无业游民 The Unemployable,"斜杠, 在家, 实习, 求学, 下岗, 自雇, 带孩, 养老, 不工作不等于和世界失去联系. 和无业游民一起, 从全时间的雇佣关系中脱身片刻, 给被遗忘的自己多一点点问候:","Slash, at home, internship, schooling, laid-off, self-employed, with a child, pension, not working does not mean losing contact with the world. Together with the unemployed, take a moment from the full-time employment relationship and give the forgotten self a little more greetings:",https://podcasts.apple.com/cn/podcast/%E6%97%A0%E4%B8%9A%E6%B8%B8%E6%B0%91-the-unemployable/id1441243418?uo=2,https://theue.me/feed/podcast,https://is3-ssl.mzstatic.com/image/thumb/Music113/v4/9d/a2/4d/9da24d38-08e8-405c-07c8-808db69d4106/source/600x600bb.jpg,"Slash, at home, internship, schooling, laid-off,<br>self-employed, with a child, pension, not working<br>does not mean losing contact with the world.<br>Together with the unemployed, take a moment from<br>the full-time employment relationship and give the<br>forgotten self a little more greetings: ...","无业游民 The Unemployable<br>Slash, at home, internship, schooling, laid-off,<br>self-employed, with a child, pension, not working<br>does not mean losing contact with the world.<br>Together with the unemployed, take a moment from<br>the full-time employment relationship and give the<br>forgotten self a little more greetings: ...",-1.0442833,9.103938
17,China,250500859,StoryCorps,"Stories of the human heart. A candid, unscripted conversation between two people about what's really important in life: love, loss, family, friendship. When the world seems out of hand, tune in to StoryCorps and be reminded of the things that matter most.","Stories of the human heart. A candid, unscripted conversation between two people about what's really important in life: love, loss, family, friendship. When the world seems out of hand, tune in to StoryCorps and be reminded of the things that matter most.",https://podcasts.apple.com/cn/podcast/storycorps/id250500859?uo=2,https://www.npr.org/rss/podcast.php?id=510200,https://is1-ssl.mzstatic.com/image/thumb/Music123/v4/0c/a4/a9/0ca4a993-fa30-e64f-1eb6-9aafafc9c602/source/600x600bb.jpg,"Stories of the human heart. A candid, unscripted<br>conversation between two people about what's<br>really important in life: love, loss, family,<br>friendship. ...","StoryCorps<br>Stories of the human heart. A candid, unscripted<br>conversation between two people about what's<br>really important in life: love, loss, family,<br>friendship. ...",0.22044179,12.765319
18,China,1160680684,英语漫游记,"用轻松快乐的方式, 教你旅途中的实用口语, 让你畅游世界. 同时, 我们也想你展示世界各地新鲜有趣的人文风情. 让我们操一口流利的英文, 勇敢上路吧!","In a relaxed and happy way, teach you the practical spoken words on the journey, let you swim the world. At the same time, we also want you to showcase the fresh and interesting humanities around the world. Let us speak fluent English, be brave on the road!",https://podcasts.apple.com/cn/podcast/%E8%8B%B1%E8%AF%AD%E6%BC%AB%E6%B8%B8%E8%AE%B0/id1160680684?uo=2,http://feed.cri.cn/rss/b0bec710-305a-5a1a-81a9-3980e9fe6938,https://is3-ssl.mzstatic.com/image/thumb/Music113/v4/1c/ee/df/1ceedfa3-eaef-a3ae-090b-0aad693c24f6/source/600x600bb.jpg,"In a relaxed and happy way, teach you the<br>practical spoken words on the journey, let you<br>swim the world. At the same time, we also want you<br>to showcase the fresh and interesting humanities<br>around the world. ...","英语漫游记<br>In a relaxed and happy way, teach you the<br>practical spoken words on the journey, let you<br>swim the world. At the same time, we also want you<br>to showcase the fresh and interesting humanities<br>around the world. ...",-0.27365354,-10.06984
19,China,1371914428,1UP 播客 - 每期聊一个好作品,"大家好, 我是王晓光 (@cbvivi) . 在这个播客里, 我会跟朋友们聊一些作品, 像是剧集, 游戏, 电影, 可能还有些别的. 如果你也看过 / 玩过 / 听过这些作品, 播客听起来会更有意思.","Hello everyone, I am Wang Xiaoguang (@cbvivi) . In this podcast, I will talk to friends about some works, such as dramas, games, movies, and maybe something else. If you have seen / played / heard of these works, the podcasts will sound more interesting.",https://podcasts.apple.com/cn/podcast/1up-%E6%92%AD%E5%AE%A2-%E6%AF%8F%E6%9C%9F%E8%81%8A%E4%B8%80%E4%B8%AA%E5%A5%BD%E4%BD%9C%E5%93%81/id1371914428?uo=2,https://feeds.fireside.fm/1up/rss,https://is2-ssl.mzstatic.com/image/thumb/Music113/v4/3b/a1/89/3ba189ce-be75-eb77-6e53-154663ac531a/source/600x600bb.jpg,"Hello everyone, I am Wang Xiaoguang (@cbvivi) . In<br>this podcast, I will talk to friends about some<br>works, such as dramas, games, movies, and maybe<br>something else. ...","1UP 播客 - 每期聊一个好作品<br>Hello everyone, I am Wang Xiaoguang (@cbvivi) . In<br>this podcast, I will talk to friends about some<br>works, such as dramas, games, movies, and maybe<br>something else. ...",-10.4965,-3.0207577
