index,country_fullname,podcast_id,im_name_label,summary_label,summary_label_en_cleaned,link_attributes_href,feedurl,artwork,summary_label_en_cleaned_brief,hover_text,x,y
77,France,423534806,Au cœur de l'histoire,"Un voyage dans le temps pour éclairer notre présent. Dans ses récits d'histoire inédits, Fabrice d'Almeida tisse un lien entre un fait d'actualité récent et un événement historique. Une production Europe 1 Studio avec l'aide précieuse des archives d'Europe 1.","A trip back in time to enlighten our present. In his unpublished historical stories, Fabrice d'Almeida weaves a link between a recent news event and a historical event. A production Europe 1 Studio with the precious help of the archives of Europe 1.",https://podcasts.apple.com/fr/podcast/au-c%C5%93ur-de-lhistoire/id423534806?uo=2,https://www.europe1.fr/rss/podcasts/au-coeur-de-l-histoire.xml,https://is5-ssl.mzstatic.com/image/thumb/Music123/v4/72/81/e3/7281e3e0-ba6c-bc77-8781-3eff223ba626/source/600x600bb.jpg,"A trip back in time to enlighten our present. In<br>his unpublished historical stories, Fabrice<br>d'Almeida weaves a link between a recent news<br>event and a historical event. ...","Au cœur de l'histoire<br>A trip back in time to enlighten our present. In<br>his unpublished historical stories, Fabrice<br>d'Almeida weaves a link between a recent news<br>event and a historical event. ...",-8.5136385,8.945819
78,France,1122181463,Transfert,"Vous avez toujours rêvé de connaître les péripéties secrètes du couple de vos bruyants voisins, ce qui a transformé la personnalité de votre cousin, la raison pour laquelle votre collègue n'arrive plus à faire confiance à personne. Toutes les deux semaines, Transfert vous raconte une histoire vraie, excitante, prenante, émouvante, et en creux le monde moderne et ceux qui l'habitent. Un podcast de Slate.fr présenté par Charlotte Pudlowski produit par Louie Média.","You have always dreamed of knowing the secret adventures of the couple of your noisy neighbors, which has transformed the personality of your cousin, the reason why your colleague can no longer trust anyone. Every two weeks, Transfert tells you a true story, exciting, engaging, moving, and sinking the modern world and those who live there. A podcast of Slate.fr presented by Charlotte Pudlowski produced by Louie Média.",https://podcasts.apple.com/fr/podcast/transfert/id1122181463?uo=2,http://feeds.megaphone.fm/transfert,https://is1-ssl.mzstatic.com/image/thumb/Music123/v4/84/c0/49/84c04908-9181-ceb0-070c-d2a2dcd47830/source/600x600bb.jpg,"You have always dreamed of knowing the secret<br>adventures of the couple of your noisy neighbors,<br>which has transformed the personality of your<br>cousin, the reason why your colleague can no<br>longer trust anyone. ...","Transfert<br>You have always dreamed of knowing the secret<br>adventures of the couple of your noisy neighbors,<br>which has transformed the personality of your<br>cousin, the reason why your colleague can no<br>longer trust anyone. ...",10.860845,0.036324576
79,France,390167127,"LSD, La série documentaire","Documenter toutes les expériences de la vie, des cultures et des savoirs. Chaque semaine, un grand thème en quatre épisodes, autonomes et complémentaires. Du lundi au vendredi de 17h à 18h.","Document all experiences of life, cultures and knowledge. Each week, a big theme in four episodes, autonomous and complementary. Monday to Friday from 17h to 18h.",https://podcasts.apple.com/fr/podcast/lsd-la-s%C3%A9rie-documentaire/id390167127?uo=2,http://radiofrance-podcast.net/podcast09/rss_10177.xml,https://is2-ssl.mzstatic.com/image/thumb/Music113/v4/fc/a7/dd/fca7dddd-30f5-f210-d790-a139b7354234/source/600x600bb.jpg,"Document all experiences of life, cultures and<br>knowledge. Each week, a big theme in four<br>episodes, autonomous and complementary. Monday to<br>Friday from 17h to 18h. ...","LSD, La série documentaire<br>Document all experiences of life, cultures and<br>knowledge. Each week, a big theme in four<br>episodes, autonomous and complementary. Monday to<br>Friday from 17h to 18h. ...",-12.755692,9.681767
80,France,1228554342,Change ma vie : Outils pour l'esprit,"Change ma vie, c'est le podcast qui vous donne des outils pour votre esprit. Au fil des épisodes, nous allons parler de nos vies intérieures, du pouvoir stupéfiant de nos pensées, et comment on fait pour se sentir vraiment bien. Parmi les thématiques abordées : image de soi, relations aux autres, épanouissement, maturité émotionnelle, méditation, créativité, productivité, état d'esprit... Change ma vie est un podcast frais et moderne publié tous les jeudis par Clotilde Dusoulier, une parisienne trentenaire.","Change my life is the podcast that gives you tools for your mind. Throughout the episodes, we will talk about our inner lives, the amazing power of our thoughts, and how we do to feel really good. Among the topics covered: self-image, relationships to others, fulfillment, emotional maturity, meditation, creativity, productivity, state of mind ... Change my life is a fresh and modern podcast published every Thursday by Clotilde Dusoulier, a Parisian thirty.",https://podcasts.apple.com/fr/podcast/change-ma-vie-outils-pour-lesprit/id1228554342?uo=2,http://changemavie.libsyn.com/rss,https://is3-ssl.mzstatic.com/image/thumb/Music113/v4/07/26/8d/07268da0-6d65-d5ec-1b01-0ffe0bb7dbd3/source/600x600bb.jpg,"Change my life is the podcast that gives you tools<br>for your mind. Throughout the episodes, we will<br>talk about our inner lives, the amazing power of<br>our thoughts, and how we do to feel really good.<br>...","Change ma vie : Outils pour l'esprit<br>Change my life is the podcast that gives you tools<br>for your mind. Throughout the episodes, we will<br>talk about our inner lives, the amazing power of<br>our thoughts, and how we do to feel really good.<br>...",17.647398,-4.570169
81,France,1465258167,Afrofuturismes,"Qu'est-ce que l'Afrofuturisme ? RFI vous propose une série de podcasts pour y répondre. Une création originale qui sonde l'histoire et l'actualité d'une idée aux contours mouvants, née aux Etats-Unis, et qui depuis une dizaine d'années a traversé l'Atlantique pour trouver des émules en Europe et en Afrique. Où il s'agit de s'inspirer des expériences noires pour inventer des futurs alternatifs à ceux proposés aujourd'hui. - Une idée de Sinatou Saka, écrit par Vladimir Cagnolari et produit par Simon Decreuze - La série est diffusée sur RFI, cet été, du 26 au 30 août 2019.","What is Afrofuturism? RFI offers you a series of podcasts to answer them. An original creation which probes the history and the actuality of an idea with moving contours, born in the United States, and which since about ten years crossed the Atlantic to find emulators in Europe and in Africa. Where it is to be inspired by black experiences to invent future alternatives to those proposed today. - An idea of Sinatou Saka, written by Vladimir Cagnolari and produced by Simon Decreuze - The series is broadcast on RFI, cet été, du 26 au 30 août 2019.",https://podcasts.apple.com/fr/podcast/afrofuturismes/id1465258167?uo=2,http://www.rfi.fr/emission/afrofuturismes-podcast/podcast,https://is5-ssl.mzstatic.com/image/thumb/Music113/v4/3e/81/0a/3e810a7a-f9aa-2017-b892-e4d5b080e54b/source/600x600bb.jpg,"What is Afrofuturism? RFI offers you a series of<br>podcasts to answer them. An original creation<br>which probes the history and the actuality of an<br>idea with moving contours, born in the United<br>States, and which since about ten years crossed<br>the Atlantic to find emulators in Europe and in<br>Africa. ...","Afrofuturismes<br>What is Afrofuturism? RFI offers you a series of<br>podcasts to answer them. An original creation<br>which probes the history and the actuality of an<br>idea with moving contours, born in the United<br>States, and which since about ten years crossed<br>the Atlantic to find emulators in Europe and in<br>Africa. ...",-9.784979,8.138907
82,France,541596220,Le Débat de midi,Le Débat de midi,The Lunchtime Debate,https://podcasts.apple.com/fr/podcast/le-d%C3%A9bat-de-midi/id541596220?uo=2,http://radiofrance-podcast.net/podcast09/rss_12440.xml,https://is2-ssl.mzstatic.com/image/thumb/Music123/v4/53/fd/2c/53fd2c4f-f9c9-294c-5468-95d3375736a5/source/600x600bb.jpg,The Lunchtime Debate ...,Le Débat de midi<br>The Lunchtime Debate ...,-1.8832102,-0.3775312
83,France,1172772210,La Poudre,"Lauren Bastide reçoit dans une chambre d'hôtel une femme inspirante, artiste, activiste, politique pour une conversation intime et profonde sur son enfance, sa carrière et ses combats. Comment les femmes qui font le 21ème siècle ont-elles été façonnées par l'éducation qu'elles ont reçue, les invectives de la société, leur rapport à leur corps ? Un nouvel épisode, un jeudi sur deux. La Poudre was created by journalist, feminist activist and co-founder of Nouvelles Écoutes Lauren Bastide in order to offer women a safe space to express themselves. La Poudre is a one-hour long intimate, in-depth conversation with an inspirational woman. Artists and activists join Lauren on her podcast to talk about their path, career and experience with being a woman in our world. Some episodes of La Poudre are dubbed in English. Look for the 🇬🇧 !","Lauren Bastide receives in an hotel room an inspiring woman, artist, activist, politician for an intimate and profound conversation about her childhood, her career and her battles. How were women in the 21st century shaped by the education they received, the invectives of society, their relationship to their bodies? A new episode, every other Thursday. La Poudre was created by journalist, feminist activist and co-founder of Nouvelles Écoutes Lauren Bastide in order to offer women a safe space to express themselves. La Poudre is a one-hour long intimate, in-depth conversation with an inspirational woman. Artists and activists join Lauren on her podcast to talk about their path, career and experience with being a woman in our world. Some episodes of La Poudre are dubbed in English. Look for the 🇬🇧 !",https://podcasts.apple.com/fr/podcast/la-poudre/id1172772210?uo=2,https://rss.art19.com/la-poudre,https://is2-ssl.mzstatic.com/image/thumb/Music113/v4/45/f4/ae/45f4aef9-6e84-e842-e85e-6147032eda77/source/600x600bb.jpg,"Lauren Bastide receives in an hotel room an<br>inspiring woman, artist, activist, politician for<br>an intimate and profound conversation about her<br>childhood, her career and her battles. ...","La Poudre<br>Lauren Bastide receives in an hotel room an<br>inspiring woman, artist, activist, politician for<br>an intimate and profound conversation about her<br>childhood, her career and her battles. ...",-10.583643,4.9293694
84,France,1365852206,"La Leçon, le podcast sur l'art d'échouer",Faire parler des gens au parcours inspirant d'un échec qui les a façonnés. Et de La leçon qu'ils en ont tirée.,Make people talk about the inspiring journey of failure that shaped them. And from The lesson they learned from it.,https://podcasts.apple.com/fr/podcast/la-le%C3%A7on-le-podcast-sur-lart-d%C3%A9chouer/id1365852206?uo=2,https://feed.ausha.co/omXz9F9r9NOe,https://is4-ssl.mzstatic.com/image/thumb/Music113/v4/6c/c8/03/6cc803c2-cf03-1553-70b8-97bdf1bb7959/source/600x600bb.jpg,Make people talk about the inspiring journey of<br>failure that shaped them. And from The lesson they<br>learned from it. ...,"La Leçon, le podcast sur l'art d'échouer<br>Make people talk about the inspiring journey of<br>failure that shaped them. And from The lesson they<br>learned from it. ...",8.689899,0.29659224
85,France,389542173,L'heure du crime,"Du lundi au jeudi de 20h à 21h, Jacques Pradel nous plonge dans les arcanes de la police et de la justice. Entouré de spécialistes, archives sonores, protagonistes et grands témoins à l'appui, il rouvre les enquêtes des plus grandes affaires judiciaires.","From Monday to Thursday from 8 pm to 9 pm, Jacques Pradel plunges us into the mysteries of police and justice. Surrounded by specialists, sound archives, protagonists and great witnesses in support, he reopens the investigations of the biggest judicial cases.",https://podcasts.apple.com/fr/podcast/lheure-du-crime/id389542173?uo=2,https://www.rtl.fr/podcast/l-heure-du-crime.xml,https://is5-ssl.mzstatic.com/image/thumb/Music123/v4/a8/2b/d8/a82bd88d-41bb-0801-0fb2-19b51bc54eb0/source/600x600bb.jpg,"From Monday to Thursday from 8 pm to 9 pm, Jacques<br>Pradel plunges us into the mysteries of police and<br>justice. Surrounded by specialists, sound<br>archives, protagonists and great witnesses in<br>support, he reopens the investigations of the<br>biggest judicial cases. ...","L'heure du crime<br>From Monday to Thursday from 8 pm to 9 pm, Jacques<br>Pradel plunges us into the mysteries of police and<br>justice. Surrounded by specialists, sound<br>archives, protagonists and great witnesses in<br>support, he reopens the investigations of the<br>biggest judicial cases. ...",6.5712028,21.361643
86,France,1016823985,Les Grandes traversées,Des portraits documentaires de personnalités singulières. Du lundi au vendredi de 9h à 11h.,Documentary portraits of singular personalities. Monday to Friday from 9am to 11am.,https://podcasts.apple.com/fr/podcast/les-grandes-travers%C3%A9es/id1016823985?uo=2,http://radiofrance-podcast.net/podcast09/rss_14373.xml,https://is2-ssl.mzstatic.com/image/thumb/Music113/v4/df/92/94/df929488-1eb2-b2c3-0af6-0ec30aa5ceaf/source/600x600bb.jpg,Documentary portraits of singular personalities.<br>Monday to Friday from 9am to 11am. ...,Les Grandes traversées<br>Documentary portraits of singular personalities.<br>Monday to Friday from 9am to 11am. ...,-10.079753,11.146048
87,France,1233992877,Vlan!,"Vlan, c'est un podcast pour mieux comprendre notre société sans blabla ou prise de tête. Vlan, c'est une discussion entre Grégory Pouy et une personne éclairée et passionnée - Chercheur, anthropologue, journaliste... avec autant que possible un angle positif. Tous les mardi, recevez un nouvel épisode court pour comprendre les grands mouvements du moment","Vlan is a podcast to better understand our moving society. Vlan is a discussion between Grégory Pouy and an enlightened and passionate person - researcher, anthropologist, journalist, marketers ... Every Tuesday, receive a new short episode to better understand the evolution of society, understand the great movements from the moment",https://podcasts.apple.com/fr/podcast/vlan/id1233992877?uo=2,https://feed.pippa.io/public/shows/vlan,https://is4-ssl.mzstatic.com/image/thumb/Music123/v4/22/38/46/223846f3-a754-575f-3c95-209aa6b21d48/source/600x600bb.jpg,"Vlan is a podcast to better understand our moving<br>society. Vlan is a discussion between Grégory Pouy<br>and an enlightened and passionate person -<br>researcher, anthropologist, journalist, marketers<br>... Every Tuesday, receive a new short episode to<br>better understand the evolution of society,<br>understand the great movements from the moment ...","Vlan!<br>Vlan is a podcast to better understand our moving<br>society. Vlan is a discussion between Grégory Pouy<br>and an enlightened and passionate person -<br>researcher, anthropologist, journalist, marketers<br>... Every Tuesday, receive a new short episode to<br>better understand the evolution of society,<br>understand the great movements from the moment ...",11.870527,-11.629138
88,France,1395432035,Regard,"Découvrez Regard, un podcast de Birchbox qui tisse le fil passionnant de la beauté des femmes. Tous les quinze jours découvrez une nouvelle personnalité qui explore le regard que l'on porte sur soi, celui que l'on imagine que les autres portent, celui que l'on aimerait porter sur les autres… D'anecdotes légères en histoires poignantes, Regard nous dévoile des moments de vie dans lesquels chaque femme pourra se reconnaître. Un podcast Birchbox produit par Louie Creative Présentation: Caroline Langlois Musique: Benjamin Grossmann Mix: Jean-Baptiste Aubonnet Coordination: Cyrielle Bedu","Birchbox launches Regard, a podcast that weaves the exciting thread of women's beauty. Every Tuesday, discover a new personality that explores the way we look at ourselves, the one we imagine that others wear, the one we would like to wear on others ... Light anecdotes in poignant stories, Regard reveals us moments of life in which each woman will be able to recognize herself. A Birchbox podcast produced by Louie Creative Presentation: Clémence Cousteau Editing: Hanna Taieb Music: Benjamin Grossman Mix: Jean-Baptiste Aubonnet",https://podcasts.apple.com/fr/podcast/regard/id1395432035?uo=2,https://feed.pippa.io/public/shows/5b17feb80071391c2b9dd2a8,https://is1-ssl.mzstatic.com/image/thumb/Music113/v4/1a/cf/b4/1acfb494-60ce-0d6d-771d-d7896a00d446/source/600x600bb.jpg,"Birchbox launches Regard, a podcast that weaves<br>the exciting thread of women's beauty. Every<br>Tuesday, discover a new personality that explores<br>the way we look at ourselves, the one we imagine<br>that others wear, the one we would like to wear on<br>others ... Light anecdotes in poignant stories,<br>Regard reveals us moments of life in which each<br>woman will be able to recognize herself. ...","Regard<br>Birchbox launches Regard, a podcast that weaves<br>the exciting thread of women's beauty. Every<br>Tuesday, discover a new personality that explores<br>the way we look at ourselves, the one we imagine<br>that others wear, the one we would like to wear on<br>others ... Light anecdotes in poignant stories,<br>Regard reveals us moments of life in which each<br>woman will be able to recognize herself. ...",-8.53593,3.6745656
89,France,1465110916,Les Françaises au lit,"Que font les Françaises au lit ? Comment vivent-elles leurs désirs ? Comment arrivent-elles à l'orgasme ? La sexualité est-elle toujours un sujet tabou ? Elles s'appellent Iris, Danielle ou Audrey, elles ont entre 20 et 79 ans, vivent à Rennes, Lyon ou en région parisienne et elles ont accepté de se confier sur leur vie sexuelle. Masturbation, fantasmes ou pornographie, dans ce podcast, une dizaine de femmes témoignent. Une prise de parole décomplexée et commentée par des expertes, qui permet de lever le voile sur les idées reçues en matière de sexualité féminine. Les Françaises au lit est un podcast RTL Originals adapté d'un programme Téva . Direction : Antoine Daccord . Production : Alice Boryczka . Rédaction en chef : Virginie Hénaff . Journaliste : Arièle Bonte . Développement : Alix de Goldschmidt .","What do French women do in bed? How do they live their desires? How do they arrive at orgasm? Is sexuality always a taboo subject? They are called Iris, Danielle or Audrey, they are between 20 and 79 years old, live in Rennes, Lyon or in the Paris region and they have agreed to confide in their sex life. Masturbation, fantasies or pornography, in this podcast, a dozen women testify. An uninhibited and commented speech by experts, which allows to lift the veil on the ideas received about feminine sexuality. The French in bed is a RTL Originals podcast adapted from a Teva program. Direction : Antoine Daccord . Production : Alice Boryczka . Rédaction en chef : Virginie Hénaff . Journalist: Arièle Bonte. Development: Alix de Goldschmidt.",https://podcasts.apple.com/fr/podcast/les-fran%C3%A7aises-au-lit/id1465110916?uo=2,https://www.rtl.fr/podcast/les-francaises-au-lit.xml,https://is1-ssl.mzstatic.com/image/thumb/Music113/v4/24/bc/dc/24bcdc34-a3d7-e7da-046b-d64e236467ee/source/600x600bb.jpg,"What do French women do in bed? How do they live<br>their desires? How do they arrive at orgasm? Is<br>sexuality always a taboo subject? They are called<br>Iris, Danielle or Audrey, they are between 20 and<br>79 years old, live in Rennes, Lyon or in the Paris<br>region and they have agreed to confide in their<br>sex life. ...","Les Françaises au lit<br>What do French women do in bed? How do they live<br>their desires? How do they arrive at orgasm? Is<br>sexuality always a taboo subject? They are called<br>Iris, Danielle or Audrey, they are between 20 and<br>79 years old, live in Rennes, Lyon or in the Paris<br>region and they have agreed to confide in their<br>sex life. ...",1.9944452,3.5638952
90,France,1461784806,1000 Degrés,"Pendant plusieurs mois, les journalistes Adèle Humbert et Emilie Denètre ont travaillé sur une vieille affaire judiciaire. En 1994, un colis piégé explose devant l'entreprise Medilens, une petite société de fabrication de lentilles de contact située près de Toulouse. 1000 Degrés est la première investigation narrative française.","For several months, journalists Adèle Humbert and Emilie Denètre worked on an old court case. In 1994, a parcel bomb explodes in front of Medilens, a small contact lens manufacturing company near Toulouse. 1000 Degrees is the first French narrative investigation.",https://podcasts.apple.com/fr/podcast/1000-degr%C3%A9s/id1461784806?uo=2,https://rss.acast.com/1000degres,https://is5-ssl.mzstatic.com/image/thumb/Music123/v4/b6/2e/47/b62e4725-32ac-f9d2-17cd-b318734a823a/source/600x600bb.jpg,"For several months, journalists Adèle Humbert and<br>Emilie Denètre worked on an old court case. In<br>1994, a parcel bomb explodes in front of Medilens,<br>a small contact lens manufacturing company near<br>Toulouse. ...","1000 Degrés<br>For several months, journalists Adèle Humbert and<br>Emilie Denètre worked on an old court case. In<br>1994, a parcel bomb explodes in front of Medilens,<br>a small contact lens manufacturing company near<br>Toulouse. ...",2.6193671,21.100784
91,France,1438764662,YESSS,"Un podcast de warriors. Chaque jour, les femmes sont confrontées à des barrières qui les empêchent de mener leurs vies comme elles l'entendent. YESSS revient sur les victoires de femmes ordinaires contre les injonctions et violences sexistes. Tous les mois, avec @anaisbourdet , @ZazeM , @Margaidq Création musicale : Matthieu Pernaud (www.matthieupernaud.net)","A podcast of warriors. Every day, women face barriers that prevent them from leading their lives as they see fit. YESSS discusses the victories of ordinary women against sexist injunctions and violence. Every month, with @anaisbourdet, @ZazeM, @Margaidq Musical creation: Matthieu Pernaud (www.matthieupernaud.net)",https://podcasts.apple.com/fr/podcast/yesss/id1438764662?uo=2,https://feed.ausha.co/oZRYsNNKY3ko,https://is1-ssl.mzstatic.com/image/thumb/Music123/v4/4a/1f/2e/4a1f2e31-c2bb-9f7c-0dd2-119b809d228a/source/600x600bb.jpg,"A podcast of warriors. Every day, women face<br>barriers that prevent them from leading their<br>lives as they see fit. YESSS discusses the<br>victories of ordinary women against sexist<br>injunctions and violence. ...","YESSS<br>A podcast of warriors. Every day, women face<br>barriers that prevent them from leading their<br>lives as they see fit. YESSS discusses the<br>victories of ordinary women against sexist<br>injunctions and violence. ...",-10.422947,2.3091218
92,France,1295839044,Quoi de Meuf,"Une conversation générationnelle et intersectionnelle sur la pop culture. Aux commandes : Clémentine Gallot co-créatrice de la newsletter du même nom. Une discussion déjantée et sans tabou, où l'on prendra Beyoncé très au sérieux.","A generational and intersectional conversation about pop culture. At the controls: Clémentine Gallot co-creator of the newsletter of the same name. A crazy discussion and without taboo, where we will take Beyoncé very seriously.",https://podcasts.apple.com/fr/podcast/quoi-de-meuf/id1295839044?uo=2,https://rss.art19.com/quoi-de-meuf,https://is2-ssl.mzstatic.com/image/thumb/Music113/v4/52/25/56/52255641-0029-e428-ec87-576602182fd0/source/600x600bb.jpg,"A generational and intersectional conversation<br>about pop culture. At the controls: Clémentine<br>Gallot co-creator of the newsletter of the same<br>name. A crazy discussion and without taboo, where<br>we will take Beyoncé very seriously. ...","Quoi de Meuf<br>A generational and intersectional conversation<br>about pop culture. At the controls: Clémentine<br>Gallot co-creator of the newsletter of the same<br>name. A crazy discussion and without taboo, where<br>we will take Beyoncé very seriously. ...",-11.171064,3.9198205
93,France,1435185863,Kiffe ta race,"Pourquoi le mot « race » est-il tabou ? Qu'en est-il quand on est, à la fois, victime de discriminations raciales et sexuelles ? Comment assumer son identité plurielle ? Un mardi sur deux, Rokhaya Diallo et Grace Ly reçoivent un·e invité·e pour explorer les questions raciales sur le mode de la conversation et du vécu. Kiffe ta race est un podcast de Binge Audio.","A podcast to explore all racial issues about how to talk and live, by Rokhaya Diallo and Grace Ly. Un podcast de Binge Audio.",https://podcasts.apple.com/fr/podcast/kiffe-ta-race/id1435185863?uo=2,https://feed.pippa.io/public/shows/5b8ea1614b6033401bd43d87,https://is5-ssl.mzstatic.com/image/thumb/Music113/v4/a4/9b/80/a49b8043-358f-eacc-519a-0ea88f092679/source/600x600bb.jpg,"A podcast to explore all racial issues about how<br>to talk and live, by Rokhaya Diallo and Grace Ly.<br>Un podcast de Binge Audio. ...","Kiffe ta race<br>A podcast to explore all racial issues about how<br>to talk and live, by Rokhaya Diallo and Grace Ly.<br>Un podcast de Binge Audio. ...",0.89000344,4.896409
